{
  "$schema": "https://json-schema.org/draft/2020-12/schema",
  "$id": "https://local.prototype-design-workflow/independent-review-v2.schema.json",
  "title": "Independent review v2 for cumulative prototype handoff",
  "type": "object",
  "required": [
    "schemaVersion",
    "reviewId",
    "reviewerRole",
    "reviewedAt",
    "subject",
    "scopeReview",
    "pendingReview",
    "negativeChecks",
    "triggers",
    "verdict",
    "findings"
  ],
  "properties": {
    "schemaVersion": {
      "const": "2.0.0"
    },
    "reviewId": {
      "type": "string",
      "minLength": 1
    },
    "reviewerRole": {
      "const": "independent"
    },
    "reviewedAt": {
      "type": "string",
      "pattern": "^\\d{4}-\\d{2}-\\d{2}T\\d{2}:\\d{2}:\\d{2}(?:\\.\\d+)?Z$"
    },
    "subject": {
      "type": "object",
      "required": [
        "manifestHash",
        "prototypeHash",
        "evidenceBundleHash",
        "currentSnapshotHash",
        "previousManifestHash",
        "previousSnapshotHash"
      ],
      "properties": {
        "manifestHash": {
          "type": "string",
          "pattern": "^[a-fA-F0-9]{64}$"
        },
        "prototypeHash": {
          "type": "string",
          "pattern": "^[a-fA-F0-9]{64}$"
        },
        "evidenceBundleHash": {
          "type": "string",
          "pattern": "^[a-fA-F0-9]{64}$"
        },
        "currentSnapshotHash": {
          "$ref": "#/$defs/hash"
        },
        "previousManifestHash": {
          "anyOf": [
            {
              "$ref": "#/$defs/hash"
            },
            {
              "type": "null"
            }
          ]
        },
        "previousSnapshotHash": {
          "anyOf": [
            {
              "$ref": "#/$defs/hash"
            },
            {
              "type": "null"
            }
          ]
        }
      },
      "additionalProperties": false
    },
    "triggers": {
      "type": "array",
      "minItems": 1,
      "uniqueItems": true,
      "items": {
        "enum": [
          "first-real-use",
          "rule-change",
          "complex-multi-surface",
          "full-coverage",
          "evidence-gap-or-conflict",
          "automatic-degradation",
          "repeat-failure",
          "unverified-authoritative-source",
          "unverified-prototype-lineage",
          "global-rule-classification"
        ]
      }
    },
    "verdict": {
      "enum": [
        "pass",
        "block"
      ]
    },
    "findings": {
      "type": "array",
      "items": {
        "type": "string"
      }
    },
    "scopeReview": {
      "$ref": "#/$defs/reviewSection"
    },
    "pendingReview": {
      "$ref": "#/$defs/reviewSection"
    },
    "negativeChecks": {
      "type": "array",
      "items": {
        "$ref": "#/$defs/negativeCheck"
      }
    }
  },
  "additionalProperties": false,
  "$defs": {
    "hash": {
      "type": "string",
      "pattern": "^[a-fA-F0-9]{64}$"
    },
    "reviewSection": {
      "type": "object",
      "required": [
        "result",
        "evidenceRefs",
        "note"
      ],
      "properties": {
        "result": {
          "enum": [
            "pass",
            "block"
          ]
        },
        "evidenceRefs": {
          "type": "array",
          "items": {
            "type": "string",
            "minLength": 1
          }
        },
        "note": {
          "type": "string",
          "minLength": 1
        }
      },
      "additionalProperties": false
    },
    "negativeCheck": {
      "type": "object",
      "required": [
        "checkId",
        "applicability",
        "evidenceRefs",
        "result",
        "note"
      ],
      "properties": {
        "checkId": {
          "enum": [
            "unrelated-field-preservation",
            "empty-and-missing-values",
            "historical-out-of-candidate-data",
            "unauthorized-actions",
            "concurrent-conflict",
            "post-save-membership"
          ]
        },
        "applicability": {
          "enum": [
            "applicable",
            "not-applicable"
          ]
        },
        "evidenceRefs": {
          "type": "array",
          "items": {
            "type": "string",
            "minLength": 1
          }
        },
        "result": {
          "enum": [
            "pass",
            "block",
            "not-applicable"
          ]
        },
        "note": {
          "type": "string",
          "minLength": 1
        }
      },
      "additionalProperties": false
    }
  }
}
